{
  "name": "Zoë Șerban",
  "title": "Software Engineer",
  "email": "zoe.serban@example.com",
  "phone": "+40 700 000 001",
  "location": "Cluj-Napoca, Romania",
  "links": [
    "https://example.com/zoe",
    "https://github.com/example-zoe"
  ],
  "objective": "Software engineer building accessible web applications and tested backend services. Interested in reliable APIs and clear user workflows.",
  "skills": [
    "TypeScript",
    "React",
    "Node.js",
    "PostgreSQL",
    "Python",
    "Git"
  ],
  "experience": [
    {
      "company": "Example Studio",
      "title": "Software Engineering Intern",
      "startDate": "Summer 2025 (month not confirmed)",
      "endDate": "2025-09",
      "description": "Built appointment-conflict validation in a Node.js API and added regression tests for overlapping bookings.\nReplaced an inaccessible date picker with a keyboard-operated booking flow after testing it with the product team."
    }
  ],
  "education": [
    {
      "school": "Example Technical University",
      "degree": "BSc",
      "field": "Computer Science",
      "graduationDate": "2026-06"
    }
  ],
  "projects": [
    {
      "name": "Booking Lab",
      "startDate": "2026-02",
      "endDate": "Present",
      "description": "Built an independent appointment scheduler with persistent storage and automated tests for booking conflicts.\nDocumented the tradeoff between database constraints and application validation; added a reproducible local demo.",
      "technologies": "TypeScript, React, Node.js, PostgreSQL",
      "url": "https://example.com/booking-lab"
    }
  ],
  "publications": []
}
