{
  "name": "Renée Ionescu",
  "title": "Senior Software Engineer",
  "email": "renee.ionescu@example.com",
  "phone": "+40 700 000 002",
  "location": "București, Romania",
  "links": ["https://example.com/renee", "https://github.com/example-renee"],
  "objective": "Software engineer leading reliable API and data-platform work. Builds observable services, documents operational tradeoffs and mentors engineers through delivery and incident review.",
  "skills": [
    "TypeScript",
    "React",
    "Node.js",
    "PostgreSQL",
    "Python",
    "Git",
    "Docker",
    "Kubernetes",
    "Redis",
    "OpenTelemetry"
  ],
  "experience": [
    {
      "company": "Example Systems",
      "title": "Senior Software Engineer",
      "startDate": "2023-03",
      "endDate": "Present",
      "description": "Designed a PostgreSQL-backed job queue with idempotent workers and recovery tests for interrupted tasks.\nIntroduced OpenTelemetry traces across API and worker boundaries so on-call engineers could isolate slow requests.\nLed design reviews for a staged migration from synchronous processing to background jobs, documenting rollback criteria.\nMentored engineers through incident reviews and paired on regression tests for duplicate delivery and partial failure."
    },
    {
      "company": "Sample Cloud",
      "title": "Software Engineer",
      "startDate": "2020-01",
      "endDate": "2023-02",
      "description": "Implemented versioned Node.js APIs and contract tests to keep customer integrations working through releases.\nReworked database queries after profiling production-like workloads; verified query plans before adding indexes.\nBuilt an accessible React console for reviewing failed jobs and retrying only the affected work."
    },
    {
      "company": "Demo Works",
      "title": "Junior Software Engineer",
      "startDate": "2017-07",
      "endDate": "2019-12",
      "description": "Developed Python import tools that preserved source identifiers and rejected ambiguous records for manual review.\nAdded integration tests around CSV exports, Unicode names and date handling to prevent silent data corruption."
    }
  ],
  "education": [
    {
      "school": "Example Technical University",
      "degree": "MSc",
      "field": "Distributed Systems",
      "graduationDate": "2019-06"
    },
    {
      "school": "Example Technical University",
      "degree": "BSc",
      "field": "Computer Science",
      "graduationDate": "2017-06"
    }
  ],
  "projects": [
    {
      "name": "Queue Observatory",
      "startDate": "2024-05",
      "endDate": "Present",
      "description": "Built an independent workload simulator that reproduces worker crashes and compares retry policies.\nPublished runnable test cases and design notes explaining when idempotency keys expire and how recovery is verified.",
      "technologies": "Python, PostgreSQL, Docker",
      "url": "https://example.com/queue-observatory"
    },
    {
      "name": "Accessible Booking Lab",
      "startDate": "2022-04",
      "endDate": "2022-10",
      "description": "Created a keyboard-accessible booking demo with time-zone conversion and appointment-conflict tests.\nDocumented browser support and known limitations so contributors could reproduce failures.",
      "technologies": "TypeScript, React, Node.js",
      "url": "https://example.com/accessible-booking"
    }
  ],
  "publications": []
}
